{
  "extracted_data": {
    "bill_of_lading_number": "MLU34110002",
    "container_number": "MSCU1234567",
    "consignee_name": "KABOFER TRADING INC",
    "consignee_address": "66-89 MAIN ST GH 643, FLUSHING, NY",
    "date": "2019-08-22",
    "line_items_count": 18,
    "average_gross_weight": 194.85333333333335,
    "average_price": 0.7677777777777776,
    "raw_text": "SHIPPERVESPORTER(Complete Name and Address}\nCHINA ABRASIVES EXPORT CORPORATION B34345782\n163 ZHONG YUAN WEST ROAD\n\nHBL NO.:\n“MLU341 10002\n\nCONSIGNEER Gomplete Name and Address) LOGISTICS (SHENZHEN) co. LTD\n\nKABOFER TRADING INC\n66-89 MAIN ST GH 643\n\nFLUSHING, NY, BILL OF LADING\n\nS4089 US\n\nMOTIFY PARTY {Complete Name and Address) FOR RELEASE OF SHIPMENT PLEASE CONTACT\nSAME AS CONSIGNEE INTERNATIONAL CARGO EXPRESS PTY LIMITED (BRISBANE)\n\nUNIT 1, 769 KINGSFORD SMITH DRIVE\n\nEAGLE FARM QLD 4009, ABN NUMBER : 54003500347\n\nTEL +61 (07) 36387300, FAX: +67 (07) S866 1776\nOCEAN VESSELYOY AGE PORT OF LOADING\nCOSCO BELGIUM)/095E SUANGCHAL CHINA\nPORT OF DISCHARGE PLACE OF DEUVERY FINAL DESTINATION(FOR THE MERCHANTS REFERENCE ONLY)\nLONG BEACH, CA LONG BEACH, CA\n\nPARTICULARS FURNISHED BY SHIPPER\n\nMARKS & NUMBERS NO. OF PKGS DESCRIPTION OF GOODS GROSS WEIGHT MEASUREMENT\nNM\n\n776 CARTON(S) HOUSEHOLD AND PERSONALITEMS\n\n16250000 KGS 136.000 CBM\n\nSHIPPER'’S LOAD AND COUNT AND SEAL\n1A 40°HQ\nCYICY\n\nM5CU1234567/40'HQ/EMCWOGDSD/776CARTON(S)/16250KG5/136CBM\n\nShipped on board 9 #019-0c-22\n\nFREIGHT and CHARGES PAYABLE BY TOTAL | X40°HQ CONTAINER(S) ONLY AT: DESTINATION\n\nIM ACCEPTING THIS BILL OF LADING, the Shipper, Consignes, Holder hereof and Owner of the goods agree i be bound by all of te stipulatons,exceptions and conditions, whether\nWiten, printed or stamped on the front or back hereofas well as the provisions of the above Camers published Tanff Ruless and Reguistions,as fully as if they were all signed by such\nShipper, Gonsignes. Hokier or Qwner,and if it further agree that containers ae stowed on Deck.as per Clause3.1N WITNESS WHEREBOF the Macrter of the said vecsel has affined\n\nthis Bill of Lading and authorized signature.\n\nTERMS OF LADING CONTINUED ON REVERSE SIDE | BILL OF LADING NO. PLACE AND DATE OF ISSUED\nSHENZHEN 2019-08-22\n\nNumber of orginals issued\n\n(if more than one originals issued the others stand void when ONE is acomplehed.)\n\nSheet: Invoice\nCommercial Invoice\nINV.NO.: \t INV100000LAX\nB/L NO.: \t ZMLU34110002\nSHIPPER: \t CHINA ABRASIVES EXPORT CORPORATION\nADDRESS： \t 183 ZHONG YUAN WEST ROAD\nSHIP TO： \t KABOFER TRADING INC \t CNTR NO \t MSCU1234567\nS.No. \t Description 描述 \t Qty (Pcs) 数量\n(个) \t Unit Value (USD) 单价 \t Total Value (USD) \t HS code 海关编码\n1 \t Table Toy \t 932 \t 1 \t 932 \t 8424899000\n2 \t Headphones \t 10188 \t 0.06 \t 611.28 \t 8504409580\n3 \t STORAGE BOX \t 4653 \t 0.5 \t 2326.5 \t 8518302000\n4 \t Party Supply \t 5889 \t 0.33 \t 1943.3700000000001 \t 9505.90.6000\n5 \t Bath brush \t 543 \t 0.6 \t 325.8 \t 9603.29.8010\n6 \t StICKER \t 736 \t 0.03 \t 22.08 \t 4821104000\n7 \t Hair brush \t 3466 \t 1.53 \t 5302.9800000000005 \t 9603.29.3000\n8 \t PINS \t 9555 \t 0.01 \t 95.55 \t 7319.90.9000\n9 \t Plastic cup \t 93 \t 0.63 \t 58.59 \t 3924.10.4000\n10 \t Hand fan \t 551 \t 0.97 \t 534.47 \t 6702.90.3500\n11 \t Phone COVER \t 3901 \t 1.02 \t 3979.02 \t 4202.92.9700\n12 \t Storage bag \t 1200 \t 1.02 \t 1740 \t 6305900000\n13 \t Sticker \t 2000 \t 1.02 \t 200 \t 4802543100\n14 \t Bottle opener \t 2000 \t 1.02 \t 1000 \t 7323930080\n15 \t Light bulb \t 1864 \t 1.02 \t 279.6 \t 8539228060\n16 \t pendant lights \t 30 \t 1.02 \t 360 \t 9405198010\n17 \t Cup mat \t 5000 \t 1.02 \t 3500 \t 3924901050\n18 \t nail file \t 2000 \t 1.02 \t 200 \t 8214203000\n52601 \t 23211.239999999998\nSheet: 包装清单 List\nPacking List\nS.No. \t Description 描述 \t Qty (Pcs) 数量\n(个) \t Total Gross Weight (KG)\n1 \t Table Toy \t 932 \t 464.3\n2 \t Headphones \t 10188 \t 34.5\n3 \t STORAGE BOX \t 4653 \t 664.2\nParty Supply \t 5889\nBath brush \t 543\n4 \t StICKER \t 736 \t 11.4\n5 \t Hair brush \t 3466 \t 32.8\n6 \t PINS \t 9555 \t 564.4\nPlastic cup \t 93\n7 \t Hand fan \t 551 \t 23.4\n8 \t Phone COVER \t 3901 \t 345.2\n9 \t Storage bag \t 1200 \t 71.4\n10 \t Sticker \t 2000 \t 52.4\n11 \t Bottle opener \t 2000 \t 167.8\n12 \t Light bulb \t 1864 \t 210.2\n13 \t pendant lights \t 30 \t 12.3\n14 \t Cup mat \t 5000 \t 180.3\n15 \t nail file \t 2000 \t 88.2\n54601 \t 2922.8",
    "items": [
      {
        "description": "Table Toy",
        "quantity": 932.0,
        "gross_weight": 464.3,
        "unit_price": 1.0
      },
      {
        "description": "Headphones",
        "quantity": 10188.0,
        "gross_weight": 34.5,
        "unit_price": 0.06
      },
      {
        "description": "STORAGE BOX",
        "quantity": 4653.0,
        "gross_weight": 664.2,
        "unit_price": 0.5
      },
      {
        "description": "Party Supply",
        "quantity": 5889.0,
        "gross_weight": null,
        "unit_price": 0.33
      },
      {
        "description": "Bath brush",
        "quantity": 543.0,
        "gross_weight": null,
        "unit_price": 0.6
      },
      {
        "description": "STICKER",
        "quantity": 736.0,
        "gross_weight": 11.4,
        "unit_price": 0.03
      },
      {
        "description": "Hair brush",
        "quantity": 3466.0,
        "gross_weight": 32.8,
        "unit_price": 1.53
      },
      {
        "description": "PINS",
        "quantity": 9555.0,
        "gross_weight": 564.4,
        "unit_price": 0.01
      },
      {
        "description": "Plastic cup",
        "quantity": 93.0,
        "gross_weight": null,
        "unit_price": 0.63
      },
      {
        "description": "Hand fan",
        "quantity": 551.0,
        "gross_weight": 23.4,
        "unit_price": 0.97
      },
      {
        "description": "Phone COVER",
        "quantity": 3901.0,
        "gross_weight": 345.2,
        "unit_price": 1.02
      },
      {
        "description": "Storage bag",
        "quantity": 1200.0,
        "gross_weight": 71.4,
        "unit_price": 1.02
      },
      {
        "description": "Sticker",
        "quantity": 2000.0,
        "gross_weight": 52.4,
        "unit_price": 1.02
      },
      {
        "description": "Bottle opener",
        "quantity": 2000.0,
        "gross_weight": 167.8,
        "unit_price": 1.02
      },
      {
        "description": "Light bulb",
        "quantity": 1864.0,
        "gross_weight": 210.2,
        "unit_price": 1.02
      },
      {
        "description": "pendant lights",
        "quantity": 30.0,
        "gross_weight": 12.3,
        "unit_price": 1.02
      },
      {
        "description": "Cup mat",
        "quantity": 5000.0,
        "gross_weight": 180.3,
        "unit_price": 1.02
      },
      {
        "description": "nail file",
        "quantity": 2000.0,
        "gross_weight": 88.2,
        "unit_price": 1.02
      }
    ],
    "provenance": {
      "bill_of_lading_number": "openai",
      "container_number": "openai",
      "consignee_name": "openai",
      "consignee_address": "openai",
      "date": "openai",
      "line_items_count": "manual",
      "average_gross_weight": "manual",
      "average_price": "manual"
    },
    "llm_provider": "openai"
  }
}